<?xml version="1.0" encoding="UTF-8"?>
<Interesovanje xmlns="http://www.xml.proj/gradj/interesovanje"
    xmlns:xsi="http://www.w3.org/2001/XMLSchema-instance"
    xsi:schemaLocation="http://www.xml.proj/gradj/interesovanje ../interesovanje.xsd">
    <Opcija_drzavljanin>Држављанин Републике Србије</Opcija_drzavljanin>
    <JMBG>0101980660066</JMBG>
    <Ime>Imenko</Ime>
    <Prezime>Prezimenić</Prezime>
    <Adresa_elektronske_poste>imenko.prezimenic@gmail.com</Adresa_elektronske_poste>
    <Broj_mobilnog_telefona>0654448822</Broj_mobilnog_telefona>
    <Broj_fiksnog_telefona>454334</Broj_fiksnog_telefona>
    <Lokacija>Novi Sad</Lokacija>
    <Proizvodjac_vakcine>Pfizer-BioNTech</Proizvodjac_vakcine>
    <Davalac_krvi>Da</Davalac_krvi>
    <Datum>2021-12-01</Datum>
</Interesovanje>